L1,L2,L3,L3 Name,L4,L4 Name,Description,Product Gaps,Now/Next/Later,Links to Details,Notes/Remarks
FIN-Financials,AP - New Accounts Payable,AP.06,"Dashboards, Visualizations & Analytics",AP.06.02,AP Dashboards & KPIs,"#DASHBOARDS. Real-time AP dashboards with key performance indicators. Track open invoices, payments, approval bottlenecks, aging, and process efficiency.",,Now,,
FIN-Financials,AP - New Accounts Payable,AP.06,"Dashboards, Visualizations & Analytics",AP.06.03,AP Data Visualizations & Trend Analysis,"#VISUALIZATIONS. Interactive charts and graphs for AP data. Trend analysis, period comparisons, drill-down capabilities, and visual analytics for insights.",,Later,,
FIN-Financials,AP - New Accounts Payable,AP.06,"Dashboards, Visualizations & Analytics",AP.06.04,Custom Reports & Report Builder,"#CUSTOM REPORTING. User-defined reports and ad-hoc queries. Drag-drop report builder with saved templates, scheduling, and distribution capabilities.",,Next,,
FIN-Financials,AP - New Accounts Payable,AP.06,"Dashboards, Visualizations & Analytics",AP.06.05,BI Tool Integration & Data Access,"#BI INTEGRATION. Integration with external BI tools (Power BI, Tableau, Excel). ODBC/REST API access for real-time data feeds and warehouse integration.",,Next,,
FIN-Financials,AP - New Accounts Payable,AP.06,"Dashboards, Visualizations & Analytics",AP.06.06,Open Data & Transparency APIs,"#TRANSPARENCY. Open checkbook API for public spend transparency. CSV/JSON export with privacy filters, GFOA transparency alignment, and public portal integration.",,Next,,
FIN-Financials,AP - New Accounts Payable,AP.06,"Dashboards, Visualizations & Analytics",AP.06.07,Document Management & Imaging,"#DOCUMENT MANAGEMENT. Centralized document repository for AP. Full-text search, indexing, version control, and secure storage with retrieval capabilities.",,Now,,
FIN-Financials,AP - New Accounts Payable,AP.06,"Dashboards, Visualizations & Analytics",AP.06.08,Legal Hold & Records Retention,"#COMPLIANCE. Legal hold management for AP documents. Retention schedules, immutable storage, audit/public records export packages, and e-discovery support.",,Later,,